,job_name,job_score,number_of_jobs,unemployment_rate,median_salary,job_dscription
63,Medical Assistant,6.0,132600,5.8,35850,"A medical assistant's job is a mix of traditional office work, including manning the front desk, answering phones and filing insurance forms, as well as hands-on tasks, such as preparing blood for lab tests, administering injections as permitted and making sure medical histories are accurately recorded. More specialized roles include assisting ophthalmologists or optometrists with basic vision tests and helping patients learn to insert, remove and care for contact lenses.A routine visit to the doctor is really a visit with an entire team, including a growing number of medical assistants. Medical assistants are likely the first and last faces you'll see during any medical appointment, either in your doctor's office or at a larger medical organization. The aging baby boomer population will help drive demand for more medical assistants, who will be needed to support doctors and nurses as they diagnose and treat patients. The Bureau of Labor Statistics projects 18.4 percent employment growth for medical assistants between 2020 and 2030. In that period, an estimated 132,600 jobs should open up."
64,Petroleum Engineer,6.0,2200,N/A,137330,"Petroleum engineers design equipment that extracts oil from reservoirs, which are deep pockets of rock that contain oil and gas deposits. To do this, they spend a lot of time gathering and analyzing data to extract the oil in the safest and most cost-effective ways possible. They also do a lot of evaluating and refining of systems to make them better. A decent amount of the oil extracted by petroleum engineers in the U.S. comes from Texas.As a kid growing up in West Texas, Russell Parker wanted nothing to do with oil. He saw what happened during the mid-1980s bust when the price of crude oil, or petroleum, plummeted, and more than 200,000 people lost their jobs.  But, while working on his bachelor's degree at the University of Texas at Austin, Parker found himself bored in his aeronautical engineering classes. He wanted to work in an area of engineering that moved at a faster clip and pushed the envelope. As it turned out, petroleum engineering fit the bill. Parker, now the CEO of Houston-based Phoenix Natural Resources, says the job includes a lot of science, data and technical know-how, but there's always this exciting element of the unknown.  ""You can't put a human being two miles into the earth,"" Parker says. ""You have to do all of your work with the data that you take – building models, observing the way the reservoir works – there are so many unknowns that you have to deal with."" The Bureau of Labor Statistics projects 7.6 percent employment growth for petroleum engineers between 2020 and 2030. In that period, an estimated 2,200 jobs should open up."
65,Financial Analyst,6.0,31300,4.1,83660,"Financial analysts keep their fingers on the pulse of the economy. They help their clients by recommending when to buy and sell investments and by staying current on economic trends, business news and company strategy. They also write reports that explain their analyses, share their expertise with colleagues who aren’t financial experts and sometimes communicate their perspectives to the public and financial media. Many work for financial companies, including those in the financial services and insurance industries. For their influence and sizable paychecks, financial analysts pay the price by working long hours: One in three put in between 50 and 70 hours a week.Competition for these jobs is fierce, especially among analysts new to the field.The Bureau of Labor Statistics projects 6.4 percent employment growth for financial analysts between 2020 and 2030. In that period, an estimated 31,300 jobs should open up."
66,Industrial Psychologist,5.9,100,0.9,96270,"Industrial psychologists apply the principles of psychology to the workplace.""Interestingly, I got into this field by having bad jobs,"" says Steve Kozlowski, former president of the Society for Industrial and Organizational Psychology and a psychology professor at Michigan State University. He had dropped out of college and got a job on the assembly line at a factory. ""I ran a machine. The work was monotonous, dangerous, didn't pay well, and it didn't have to be that bad."" When asked about his entry into the field, Mark Poteet, president of Organizational Research & Solutions Inc., says, ""I've always found a natural interest in people – why do people do what they do – but I've also always had an interest in business, commerce and finance."" He started asking himself questions like, ""what makes employees more productive?"" and ""what makes leaders more effective?"" And these are just some of the questions that industrial psychology addresses. Poteet describes the profession as ""a natural marriage between psychology and business."" The Bureau of Labor Statistics projects 2.2 percent employment growth for industrial psychologists between 2020 and 2030. In that period, an estimated 100 jobs should open up."
67,Computer Support Specialist,5.9,58000,5,52690,"Computer support specialists help with log-in difficulties, operating system and software malfunctions and some even need to pull out a screwdriver to open up a laptop or PC. Considering the number of phone calls, face-to-face meetings, emails and, in some cases, chats they engage in on a daily basis, people in this line of work must exhibit excellent communication skills. They need to ask users the right questions to pinpoint the issue, find a solution and then guide them step-by-step through the fix. Almost everyone has thrown up their hands in frustration after what feels like a million failed attempts to log onto their computer or more than an hour wrestling with a router to set up a home network. When you reach for the phone or keyboard to seek assistance and a little peace of mind, the person who answers on the other end is typically a computer support specialist. These tech savants work in a variety of settings – from traditional offices to universities to call centers – but the primary goal of the men and women who field often frantic pleas for help from users with computer issues is always the same: to provide the assistance they need in a friendly and effective manner. ""We need to make sure we know how to diagnose their issues and do it quickly,"" says Guido Diaz, a distributed computer systems analyst at the Florida Department of Education. ""Customer relations and troubleshooting are very important.""  Instead of responding to general requests for assistance, another segment of computer support specialists hone in on network matters. Referred to as computer network support specialists, these professionals receive their fair share of distressed phone calls and emails, but they often revolve around network problems and come from employees within their workplace rather than customers or the public. Aside from responding to and solving issues in a timely manner, network support specialists troubleshoot an organization's network computer system to ferret out potential problems and provide regular maintenance to ensure all its components function properly. As organizations upgrade outdated hardware, software and network equipment and require more experienced, knowledgeable professionals to respond to questions from users, computer support specialists will remain an in-demand job. The one blemish on this industry's job outlook: The recent rise in cloud computing could increase computer support specialists' productivity, therefore reducing the number of employees that organizations need to employ. The Bureau of Labor Statistics projects 8.9 percent employment growth for computer support specialists between 2020 and 2030. In that period, an estimated 58,000 jobs should open up."
68,Insurance Sales Agent,5.9,35500,4.2,52180,"Insurance agents sell auto, health, home and life insurance. Commercial insurance agents also sell property damage and liability policies, employee and executive coverage and product liability. Insurance is a heavily regulated field, and agents must be licensed by their state.Insurance agents are the men and women represented by some of TV's most unforgettable ad campaigns. Who can forget Geico's gecko with that adorable British accent, Allstate's memorable ""Mayhem"" character or the catchy jingle ""Nationwide is on your side""? About half of insurance agents work for an independent insurance agency or brokerage, and sell the products of many insurance companies. Nearly 20 percent are self-employed. Others work for direct insurance carriers. Commissions are an important source of income for most agents, although a smaller number hold salaried positions. Agents spend considerable time developing and pursuing sales leads. Consumer policy agents do a lot of telephone and office work, while commercial agents are more likely to be out in the field with customers. Independent agents who work for a brokerage may have irregular hours, but they also have more control over their work schedules than agents who work for an insurance company or spend most of their time in an office. There tends to be a lot of turnover in this career because many new agents struggle to earn sufficient commission income and switch to other occupations. Prospects for insurance agents are closely tied to the growth of the broader economy.The Bureau of Labor Statistics projects 7.0 percent employment growth for insurance sales agents between 2020 and 2030. In that period, an estimated 35,500 jobs should open up."
69,School Psychologist,5.9,12300,N/A,79820,"School psychologists identify, diagnose and treat students with learning disabilities, mental disorders and other behavioral, cognitive or emotional problems. They also develop plans for addressing these issues and refer students to other mental health resources when necessary. Their job duties are varied. These mental health professionals might help students manage stress, such as high school seniors applying to colleges. They might role-play with students on the autism spectrum. Or, they might counsel and refer a student who has expressed suicidal thoughts. They also might discuss a student's anxiety and depression issues with a concerned parent or guardian. And these professionals must handle a copious amount of documentation and paperwork. Pamela Agan-Smith, a school psychologist who has worked with students in the Greenville Central School District in Greenville, New York, for more than 30 years, says the biggest issues facing her students these days involve mental health. ""Public school students face a pretty stressful environment,"" she notes. For some students, this stress morphs into anxiety, depression and suicidal thoughts, and the school psychologist is the point person to address these concerns. A heightened awareness of mental health's connection to learning and the rising need of mental health services in schools are driving the demand for more school psychologists. However, this demand is tempered by state and local funding for schools, which is inadequate in some cases.The Bureau of Labor Statistics projects 10.4 percent employment growth for school psychologists between 2020 and 2030. In that period, an estimated 12,300 jobs should open up."
70,Genetic Counselor,5.9,600,4.3,85700,"Imagine a biology teacher teaming up with a therapist, and you'll start to picture what a genetic counselor does. A genetic counselor combs through a patient's family tree to highlight any potential health risks. For example, a person with a family history of cancer might meet with a genetic counselor to determine his or her risk for receiving similar diagnoses. If a patient decides to move forward with a genetic test, the counselor then coordinates laboratory work – usually a blood test – for a clearer picture of any genetic risks. Next comes the interpretation, where the counselor examines test results to look for any mutations that might explain a current disorder or syndrome, or that might predict future ones. The counselor then sits with the patient and his or her family to explain the findings and their ramifications. If necessary, genetic counselors also discuss the ways in which the information might be used in a patient's medical care.  Joy Larsen Haidle, president of the National Society of Genetic Counselors and a genetic counselor with the Humphrey Cancer Center in Robbinsdale, Minnesota, says the profession is a ""great blend of science, critical thinking, psychology and counseling."" If patients are considering a genetic test for a certain disorder, Larsen Haidle asks them to consider if it's a piece of information they really want to know. How would a patient use the information in their future plans? ""This conversation helps a patient feel more empowered with the information rather than a gene or the cancer being in control,"" she says.  The first genetic counselors graduated with master's degrees in 1971 from Sarah Lawrence College in Bronxville, New York. They went on to work with the prenatal population, assessing genetic conditions in the womb. Since then, with advances in genomics and laboratory technology – not to mention the increased awareness that celebrities like Angelina Jolie have brought to the benefits of using genetic counseling to take preventive health measures – the profession has proliferated. Larsen Haidle says there are roles for counselors to play in any subspecialty, from psychiatry to cardiology. Technological advances have also boosted the type of testing genetic counselors may administer and interpret. The Bureau of Labor Statistics projects 26.2 percent employment growth for genetic counselors between 2020 and 2030. In that period, an estimated 600 jobs should open up."
71,Chiropractor,5.9,5600,3.4,70720,"Chiropractors care for patients ailing from problems with their musculoskeletal systems. This purview is perhaps broader than it might sound because this includes nerves, bones, muscles, ligaments and tendons. These professionals use spinal adjustments and manual manipulations to address these concerns. Chiropractors will also often advise patients on lifestyle issues, including exercise, nutrition and sleep. Dr. Robert Hayden, a spokesperson for the American Chiropractic Association and owner of a private practice in Griffin, Georgia, spent 18 years as a critical care nurse before making the switch to chiropractic. ""I've been very blessed to have two careers that I really enjoyed and loved,"" Hayden says. ""I probably had some degree of burnout – not with what I did in critical care. You're confined in a room with a very sick patient and hissing ventilators, IV pumps, bouncing green balls. It was very stressful, though I enjoyed it."" But he was enjoying the hospital politics less and less. Right about that time, Hayden was attending a Bible study group, and he watched one of the members hobble into the house where they were meeting. The man was suffering from so much sciatic pain that he couldn't sit on a chair; rather, he perched awkwardly on the ground. At the end of the meeting, another member, who was a chiropractor, adjusted some of this man's lumbar bones and the man was able to stand up nearly straight and walk out of the house. ""With the knowledge in his head and skill in his hand, [that doctor] was able to take pain away,"" Hayden says. ""I was fascinated."" Eventually, Hayden was fascinated enough to go back to school and begin a second career. Interestingly, chiropractic was also the answer to Hayden's annoyance with office politics. ""I wanted to create my own little microcosm of health care that was holistic, patient-centered and user-friendly, and I knew that I couldn't do that anywhere other than private practice."" The Bureau of Labor Statistics projects 10.8 percent employment growth for chiropractors between 2020 and 2030. In that period, an estimated 5,600 jobs should open up."
72,Pharmacist,5.9,-7000,1.3,128710,"The white-coated professionals at your neighborhood drug store do a lot more than just fill prescriptions. Pharmacists do indeed dispense medicines, but first they check for any possible interactions with other medicines or medical conditions. They also instruct patients on how to take the medicines and will inform them about what to do if certain side effects arise. A pharmacist will also keep meticulous records, coordinate with insurance companies, supervise pharmacy technicians and keep up-to-date with continuing education courses.""Pharmacists are becoming a more integral part of the health care team,"" says Heather Free, a pharmacist working in the District of Columbia. She says that pharmacists are doing more to support doctors and clinicians, for example, by giving patients immunizations and making sure that all of a patient's doctors are informed about the diverse medicines that have been prescribed. Some pharmacists are also getting involved in adherence monitoring (why it's hard for patients to take their meds) and medication therapy management, which seeks to optimize what drugs do for a patient's overall well-being.The Bureau of Labor Statistics projects -2.2 percent employment growth for pharmacists between 2020 and 2030. In that period, an estimated 7,000 jobs will be lost."
73,Electrician,5.9,66100,6.2,56900,"Electricians are responsible for the installation, maintenance and repair of electrical systems in buildings, including homes, factories, offices and retail stores. They install wiring systems, outlets and light switches; inspect circuit breakers and transformers; and repair and replace wiring when needed.“The electricians in our program can be doing anything from residential to commercial to industrial wiring,” says Derrick Atkins, training director at Minneapolis Electrical Joint Apprenticeship Training Committee. The Minneapolis Electrical JATC operates a nonprofit training center for electricians in St. Michael, Minnesota, a collaboration between the Minneapolis chapter of the National Electrical Contractors Association and the International Brotherhood of Electrical Workers Local Union 292.Electricians work in a variety of settings and specialties – basically, anywhere electricity is used. Atkins says there are different opportunities in all kinds of areas from solar and renewables, to building automation, and residential or commercial wiring.The Bureau of Labor Statistics projects 9.1 percent employment growth for electricians between 2020 and 2030. In that period, an estimated 66,100 jobs should open up."
74,Dietitian and Nutritionist,5.9,7800,4.5,63090,"Dietitians and nutritionists are experts in food and nutrition, and they advise clients how to eat in order to achieve a desired goal, whether that's losing weight or managing a chronic condition such as diabetes. Their clients might include low-income people who need to eat right on a budget. A large segment of dietitians and nutritionists are employed by hospitals to provide medical nutrition therapy and support. Evelyn Crayton, director at Living Well Associates and former president of the Academy of Nutrition and Dietetics, started down her career path because, as she puts it, ""a man who would be considered sexist now"" pointed her in the right direction.  Crayton, who attended Grambling State University in the 1960s, excelled in her science classes, and one of her professors wanted to give her some advice. He suggested that, instead of becoming a professor, she should consider home economics because men wanted their women to cook, clean and have children. She wasn't offended. ""This was the '60s,"" Crayton laughs. ""We hadn't become liberated women yet.""  Nonetheless, she took his advice and visited the university's Institute Management department, where she excelled in dietitian courses that eventually helped her acquire a coveted internship at St. Louis University. Graduate and doctorate degrees followed, as did a career that included clinical jobs, research and mentoring the next generation of professionals.  Crayton wishes her late mother could see her career trajectory. ""People told her I was a cook,"" she says. ""They didn't really know (what I did as a dietitian and nutritionist).""  The Bureau of Labor Statistics projects 10.7 percent employment growth for dietitians and nutritionists between 2020 and 2030. In that period, an estimated 7,800 jobs should open up."
75,Actor,5.8,16700,N/A,43760,"Actors perform in the theater, work in films or star in television productions. Their job is to interpret a writer's script and portray different characters on the stage or on the screen to a watching public. Their job involves reading scripts, auditioning, researching their characters, memorizing and rehearsing lines, and performing their roles. Much of the job of an actor involves looking for work, and sometimes it involves long bouts of unemployment while waiting for a break.  When he was a kid, Arbender Robinson's family moved around a lot. To make matters worse, Robinson was a self-proclaimed bookworm with a stutter. But in fourth grade at Richmond Grade School in Richmond, Illinois, all of that started to change. In an effort to draw him out of his shell, one of his teachers put him in the elementary school musical. ""It was horrible,"" Robinson says with a laugh.  But then Robinson says he fell in love with the sense of responsibility that memorizing his lines gave him, the teamwork that belonging to the cast gave him, and the sheer fun of it all.  “All of a sudden those values that parents, teachers, mentors and family tried to teach were all coming into play at one time,” Robinson says.  One well-intentioned teacher's social experiment not only gave Robinson some confidence, but it also pointed him down his future career path. After high school, Robinson studied theater at Viterbo University in La Crosse, Wisconsin. He got jobs as a vocalist and an actor with Royal Caribbean Cruises and Walt Disney World, before moving to New York City, where he earned parts in Broadway shows like ""Hairspray."" Robinson has also worked in the Broadway revival of ""Shuffle Along.""The Bureau of Labor Statistics projects 32.4 percent employment growth for actors between 2020 and 2030. In that period, an estimated 16,700 jobs should open up."
76,Security Guard,5.8,154200,7.7,31050,"Security guards protect people against fire, theft, vandalism, terrorism, and other illegal and dangerous threats. They ensure safety by actively patrolling or using security systems to keep a watchful eye over a facility. Like police officers, many security guards are armed with weapons. Specific tasks vary by setting. Transportation guards use detectors to screen passengers, while security guards at casinos look out for cheating and underage gamblers. Although movies give security guards a bad rap by depicting frequent snoozing on the job, in reality, there's little downtime in this line of work, as guards must remain alert to watch for any suspicious activity.The Bureau of Labor Statistics projects 14.6 percent employment growth for security guards between 2020 and 2030. In that period, an estimated 154,200 jobs should open up."
