,job_name,job_score,number_of_jobs,unemployment_rate,median_salary,job_dscription
48,Licensed Practical and Licensed Vocational Nurse,6.3,63800,3.8,48820,"Licensed practical and licensed vocational nurses check vital signs, perform enemas, install catheters, dress wounds, deliver medicine, massage muscles, assist patients in maintaining their hygiene, help with feeding (for infants to the elderly), start IVs, monitor medical equipment and so much more. There is no health care professional who doesn't perform an essential task, but licensed practical and licensed vocational nurses have a suite of responsibilities that are truly basic yet absolutely imperative for quality medical care. Despite a convoluted name, the true differences between a licensed practical nurse, or an LPN, and a licensed vocational nurse, or an LVN, are ones of semantics and location. LVN is the term for this occupation in California and Texas. Within the nursing hierarchy, LPNs and LVNs usually supervise nursing aides and orderlies, but work under registered nurses and nurse practitioners.The nature of their work means licensed practical and licensed vocational nurses often have the most intimate, hands-on relationship with patients of any other professional in this industry's sphere. Having bedside manner isn't just a catchphrase for this job - it's a necessity for the patient's well-being and for the nurse's career advancement.The Bureau of Labor Statistics projects 9.3 percent employment growth for licensed practical and licensed vocational nurses between 2020 and 2030. In that period, an estimated 63,800 jobs should open up."
49,Wind Turbine Technician,6.2,4700,N/A,56230,"Wind turbine technicians, also known as wind techs, are the professionals in charge of inspecting and maintaining wind turbines. That means that most of their days are spent way up high in a turbine performing maintenance or troubleshooting the turbine's electrical, mechanical or hydraulic components and replacing or fixing malfunctioning components.Auston Van Slyke, former program director of the Wind Energy Technology program at Ecotech Institute in Aurora, Colorado, began thinking about wind turbines in 2006 as a Marine.""I got lost on deployment in Japan and stumbled across these wind turbines,"" Van Slyke says. ""They were massive, hundreds of feet tall, and I guess that's what sparked my interest.""When Van Slyke transitioned out of the military, a career as a wind turbine technician appealed to him. Along with the technical aspect of working on turbines, from the hydraulics to the composites, the profession also offered good pay and benefits, as well as the ability to travel.The Bureau of Labor Statistics projects 68.2 percent employment growth for wind turbine technicians between 2020 and 2030. In that period, an estimated 4,700 jobs should open up."
50,Psychiatrist,6.2,3500,6.2,208000,"Psychiatrists are physicians who diagnose, treat and work to prevent disorders relating to the mind and mental health. Having undergone medical school and psychiatry residency programs, these professionals are equipped to understand the complex relationships between ailments of the mind and body. They are also trained to evaluate the entire spectrum of a patient's health, make a diagnosis and design a treatment plan. Patients might suffer from mental health conditions, such as schizophrenia, bipolar disorder and depression, and receive a form of treatment known as psychotherapy – a fancy word for meetings in which a patient discusses his or her moods, problems and feelings with a psychiatrist. Psychiatrists can also prescribe a wide range of drugs or even recommend hospitalizations. For Judith Orloff, the last thing she wanted to be when she grew up was a doctor – even though she had 25 physicians in the family, including her mom and dad. ""I thought physicians were incredibly nice, but I found them to be a little boring,"" she says. But one day, she heard a voice telling her that she would, in fact, join the family trade. Intrigued, she signed up for a course at a community college, which eventually led to medical school at the University of Southern California, an internship at Wadsworth Veterans Hospital and a residency at the University of California – Los Angeles. Orloff has built her career as a motivational speaker, writer (""Emotional Freedom,"" her book on inner peace, is a New York Times bestseller), an assistant clinical professor of psychiatry at UCLA and a practicing psychiatrist in Santa Monica, California.Orloff hopes that more psychiatrists will take into account a patient's whole mind, body and spirit when evaluating, diagnosing and treating a patient. ""Integrating traditional medicine with complementary practices like energy work, spiritual beliefs, yoga and meditation is the best road [to treating patients],"" she says. The Bureau of Labor Statistics projects 12.5 percent employment growth for psychiatrists between 2020 and 2030. In that period, an estimated 3,500 jobs should open up."
51,Computer Systems Administrator,6.2,18800,2.1,84810,"Computer systems administrators set up and maintain an organization's computer servers. In a single day, they may encounter stacks of servers, dozens of crisscrossing network cables and major malfunctions with the hardware and software that runs the company's local area and wide area networks. A network and computer systems administrator's greatest contribution is maintaining an organization's work flow and keeping its lines of communication open. This work is not for the faint of heart. Since companies depend on their networks for so much of their work, problems must be corrected swiftly and completely. Aside from identifying network issues and fixing them, computer systems administrators must also make updates to all equipment and software so they're current. Another important aspect of the job is ensuring email and data storage networks work properly and employee workstations are connected to the central computer network. They also train new users on how to use relevant hardware and software. Some network and computer systems administrators also manage telecommunication networks so employees can work from home or on the road, which has become increasingly important in recent years as more employees connect outside the traditional office setting. As its low unemployment rate indicates, this is an in-demand profession that's expected to grow as employers invest in new technology and faster mobile networks. More administrators will also be needed to implement upgraded security measures to protect workplace computer systems. The Bureau of Labor Statistics projects 5.4 percent employment growth for computer systems administrators between 2020 and 2030. In that period, an estimated 18,800 jobs should open up."
52,Sales Manager,6.1,27900,4.5,132290,"Sales managers are responsible for orchestrating a company or organization’s sales team. Their job includes planning how best to utilize available resources, determining and addressing any changes necessary to meet customer needs, and helping their teams improve sales performance.“They have to have a focus on improving the effectiveness of the salespeople in the organization,” says Bob Kelly, chairman and founder of the Sales Management Association. “This has become an increasing part of the sales manager job, and it positions the sales manager as a force multiplier in the organization. This is why sales managers are so important because if they’re effective in this role, they can have a compounding influence in the organization.”A sales manager’s duties can differ depending on the size of their team and whether they work in a business-to-business environment, such as a manufacturer selling to a wholesaler, or a business-to-consumer setting, such as a car dealership or other retail establishment.But regardless of where they work, sales managers generally hire and train salespeople, create plans to attract and retain customers, set sales goals, assign sales territories (if applicable), and complete assigned administrative work. In some cases, they also may deal with customers directly.“It’s less important now that sales managers supervise and sort of make sure employees are doing the right things. We now have a lot of technology that can automate that,” Kelly says. “So the sales manager role as nanny is much less valuable to firms.”The Bureau of Labor Statistics projects 7.0 percent employment growth for sales managers between 2020 and 2030. In that period, an estimated 27,900 jobs should open up."
53,Recreation and Fitness Worker,6.1,179500,17.6,31250,"Recreation and fitness workers are found in various settings, including community centers, public pools, parks, gyms and nursing care facilities. And though many roles fall under the recreation and fitness worker career umbrella, those who work in these jobs have a common cause: to help people stay active and interact with other members of the community they call home.“I engage kids and families in the community by creating fun activities from structured play to cooking, creative exercises and fitness activities,” says Emily Braxton, family programs coordinator for the Arlington County Department of Parks and Recreation in Arlington, Virginia. “Our goals are really to build the community (and) help them stay active and fit and make friends.”The Bureau of Labor Statistics projects 27.0 percent employment growth for recreation and fitness workers between 2020 and 2030. In that period, an estimated 179,500 jobs should open up."
54,Orthodontist,6.1,500,5.5,208000,"Orthodontists are dental specialists who concentrate on fixing irregularities in teeth and jaws. They straighten teeth and help correct problems such as overbites and underbites. If you’ve ever had braces or a retainer to straighten your teeth, you can thank your orthodontist for creating a corrective treatment plan specifically for your needs. “In dental school, I was fascinated with how the face and jaws grow and how the teeth, jaws and a person’s smile affect how they feel about themselves,” says Chris Roberts, 2020-21 American Association of Orthodontists president and adjunct clinical associate professor of dentistry at the University of Michigan. “It takes many years of higher education to become an orthodontist, but it is the most rewarding career I can imagine.”The Bureau of Labor Statistics projects 8.1 percent employment growth for orthodontists between 2020 and 2030. In that period, an estimated 500 jobs should open up."
55,Orthotist and Prosthetist,6.1,1900,2.3,70190,"""Orthotics"" is the branch of medicine that works with prescribing, making and managing braces or orthoses; ""prosthetics"" is the branch of medicine that works with prescribing, making and managing artificial body parts or prostheses.""My uncle lost his arm in a hang gliding accident in his young adult years,"" says Phil Stevens. ""Growing up, I have vivid memories of watching him button his shirts and eat cornflakes with his prosthesis."" That experience led Stevens down a path to becoming a practicing orthotist and prosthetist and eventually, president of the American Academy of Orthotists and Prosthetists. Today, Stevens works with patients who range in age from infants to geriatrics. He might see a child with spina bifida who needs external braces (or orthoses) to walk. He might see adults with disabilities, such as multiple sclerosis or spinal cord injuries. He also might work with patients who have sports injuries and who need braces to recover after a cast is removed. He'll see patients who were born without a limb – or without part of a limb. Other patients might have had a limb amputated because of cancer, diabetes or another illness. Stevens says he might see eight to 12 patients a day, but if it's an especially complicated case, it might be just one patient. When a patient comes to Stevens, he'll work in conjunction with the referring physician to assess the patient's physical abilities and interests. He then determines which type of prosthetic components or orthoses will be the best fit for his patients. Stevens describes his job as ""matching the most appropriate technology with the needs and capabilities of the individual."" In addition to determining the design of specific braces or prostheses, Stevens' job entails applying them to the skin, or creating a socket or ""custom interface that bears weight."" The real magic happens in the finishing touches. In New Orleans in early 2015, Stevens gave a speech to a group of O&P professionals at The Academy Annual Meeting and Scientific Symposium. There, he spoke about going the extra mile. ""I'm really speaking of those extra actions that we take during patient encounters,"" he says. ""When we look down and realize that if we took another quarter-inch off that foot plate, it would fit in the shoe a little easier, or when we ask for one more pass down the parallel bars and we give that wrench another quarter-turn to see if we can't improve the alignment."" The Bureau of Labor Statistics projects 18.4 percent employment growth for orthotists and prosthetists between 2020 and 2030. In that period, an estimated 1,900 jobs should open up."
56,Social and Community Service Manager,6.1,26400,3.9,69600,"Social and community service managers' work can take a number of shapes: They might work directly with a specific community, such as the homeless or the seriously ill, and seek to identify problems and gaps in services for that population. They might also research and design programs that address these problems. Analyzing data, writing grant proposals, and overseeing and mentoring staff are also part of the job. By acting as the voice for their particular community, they could speak to government officials about certain problems; they might even testify before Congress on behalf of their demographic.""I think we need to feel that what we do matters,"" says Shirley Otis-Green, clinical director of consulting services for the Coalition for Compassionate Care of California, an advocacy organization dedicated to improving the care of the seriously ill. ""Social work, by its very definition, is about doing work that matters. It has an inherent sense of purpose that is so rewarding.""Otis-Green is hopeful that, in the future, social and community service managers will increasingly collaborate interprofessionally so that services will be more holistic. She gives the example of oncology patients. ""The most effective way to deliver health care is with a team approach that includes a nurse, doctor, chaplain and social worker,"" she says. ""Person-centered care recognizes that there are multidimensional aspects of suffering and that an interprofessional perspective is needed to address the patient's physical, social, psychological and spiritual needs.""The Bureau of Labor Statistics projects 15.2 percent employment growth for social and community service managers between 2020 and 2030. In that period, an estimated 26,400 jobs should open up."
57,Massage Therapist,6.1,46500,17.6,43620,"Employing their unique set of tools – ""magic hands"" and a ""magic touch"" – massage therapists relieve pain, reduce stress, unwind bound-up muscles and just plain make people feel better. With more than 80 types of treatments, massage therapists have many different ways to deliver this relief. Massage therapists can specialize in deep-tissue, acupressure, reflexology, orthopedic, sports massage and other areas. Often, massage therapists become experts in several modalities, all of which require specific skills and techniques. The length and type of massage provided typically depends on the client's condition and desires. Elderly clients, pregnant women and those recovering from a severe injury usually receive different treatments than elite athletes or those simply seeking relaxation. The nature of the massage is often discussed and agreed upon during a short interview with the client before it takes place. Massage therapists work for employers in a variety of environments, including spas and hospitals, and some are self-employed with their own small businesses. Regardless of the working arrangement, massage therapists should be friendly and personable to attract a consistent client base. Want a job that aims, above all else, to make people feel better? Consider becoming a massage therapist. The increasing number of spas and massage clinics in recent years underscores a growing demand for massage services.The Bureau of Labor Statistics projects 32.2 percent employment growth for massage therapists between 2020 and 2030. In that period, an estimated 46,500 jobs should open up."
58,Mechanical Engineer,6.1,20900,4.1,90160,"Mechanical engineers research, design, develop, build and test various devices.They often have an innate curiosity about the way things work. For J. Robert Sims, former president of the American Society of Mechanical Engineers, this curiosity reared its head at age 10. ""I repaired an old radio and used an old power supply to experiment with the electrolysis of water. I produced a small amount of hydrogen that I proceeded to ignite,"" he wrote in an email. ""Good judgment is not inherent in the young – that comes later with experience.""An enthusiasm for solving problems is a vital trait of mechanical engineers, says Warren Seering, a professor of mechanical engineering at Massachusetts Institute of Technology. It takes creativity to shepherd a theoretical device into a practical reality. Computers have changed the way mechanical engineers do their work. Computing tools now ""allow complex analyses to be performed in seconds that once required days or weeks of hand calculations,"" Sims writes. But to produce a fully refined product, mechanical engineers use grittier items, such as electric generators, industrial production equipment and material-handling systems. When confronted with the more complex and analytical portions of the occupation, being a wiz in areas like calculus and trigonometry is a major advantage.Mechanical engineering is an exciting professional field, thanks to innovations like 3D printing and the development of new engineering materials like carbon fiber composites. And as a result of globalization, Seering says many mechanical engineers now work in teams and create designs for communities throughout the world.Architecture, alternative energies, remanufacturing and nanotechnology are subsets of this profession that will have openings for candidates with the right education and experience. The Bureau of Labor Statistics projects 7.0 percent employment growth for mechanical engineers between 2020 and 2030. In that period, an estimated 20,900 jobs should open up."
59,Clinical Laboratory Technician,6.0,36500,4.4,54180,"Clinical laboratory technicians are responsible for a number of tasks, including examining body fluids and cells and matching blood for transfusions. The job requires the use of sophisticated laboratory equipment, such as microscopes and cell counters. With continued advancements in technology, lab work has become more analytical, so laboratory personnel should have excellent judgment skills. More complex procedures are reserved for clinical laboratory technologists, who must possess a bachelor's degree. Technicians, who must hold at least an associate degree, often work under the supervision of technologists. Don't expect to see clinical laboratory technicians playing a leading role on ""Grey's Anatomy"" anytime soon. Leave the spotlight to the actors who play surgeons; clinical lab technicians, on the other hand, are content working hard behind the scenes. Serving as an important cog in the elaborate framework that is the modern hospital or clinic, they conduct the crucial tests and analyses that physicians use to make their diagnoses.The Bureau of Labor Statistics projects 10.9 percent employment growth for clinical laboratory technicians between 2020 and 2030. In that period, an estimated 36,500 jobs should open up."
60,Psychologist,6.0,1100,0.9,105780,"Psychologists observe patients to glean insights about how they think, feel and behave. David Scheinfeld, a psychologist working in Austin, Texas, got his start in psychology at a young age. “I was in therapy myself as a young child through my teenage years, and I still am,” Scheinfeld says. “At a fundamental level, I found a lot of importance in therapy – the way it helps provide direction to live a valued life.” After completing a double major in psychology and communication studies in undergrad, Scheinfeld earned a doctorate in psychology. These days, Scheinfeld works with geriatric patients at a rehabilitation facility during the day. In the morning, he attends an interdisciplinary meeting with nurses, physical therapists, physicians and social workers. After this, he makes his rounds; those patients who might be experiencing major life crises will come first. He’ll generally spend anywhere from 25 to 50 minutes with each patient, and he’ll see anywhere from eight to 14 patients a day. Outside working hours, he’s involved with several innovative psychology programs, including Outward Bound for Veterans, an organization that facilitates outdoor therapeutic adventures for veterans, as well as Project Rebirth, “resilience” programs aimed at caring for the psychological health of the military, veterans and first responders. “This field is not stagnant; there’s so many new and innovative ways to approach treating the mental health issues,” Scheinfeld says. “You can start in one place and end in another place. I love that flexibility.” The Bureau of Labor Statistics projects 2.0 percent employment growth for psychologists between 2020 and 2030. In that period, an estimated 1,100 jobs should open up."
61,Landscaper and Groundskeeper,6.0,85000,2.9,31730,"Although the terms landscaper and groundskeeper are sometimes used interchangeably, they define two separate jobs with distinct responsibilities. ""A landscaper is more involved with the horticultural maintenance of facilities, while a groundsworker might be involved with refuse removal and snow removal,"" says Donald Bottger, director of facility and environmental services for the San Diego Convention Center Corporation.  Other landscaper duties include planting trees and shrubbery, fertilizing and watering plants and constructing patios and walkways. And groundskeepers' work isn't confined to greenery; they might maintain swimming pools and fountains or ensure picnic areas and public spaces are free of litter. Both jobs are ideal for green thumbs and outdoorsy folks, and they're also good callings for those who have the entrepreneurial spirit to start their own lawn care and landscaping businesses. Bottger says there is plenty of potential for advancement in this career – landscapers could move up the ranks and become supervisors, while groundskeepers could be promoted to grounds managers or facilities managers.From manicured lawns on college campuses to ornate gardens at historic homes, the work of landscapers and groundskeepers surrounds us. You'll also find their handiwork in public parks, botanical gardens, sports fields and even cemeteries.  Aging baby boomers aren't just driving demand for more professionals in the health care field – they also influence job openings within landscaping and groundskeeping. Older homeowners often employ lawn care services when they can no longer tend to their homes themselves. These services are also popular among working professionals who have limited daytime hours available for yard work.The Bureau of Labor Statistics projects 7.6 percent employment growth for landscapers and groundskeepers between 2020 and 2030. In that period, an estimated 85,000 jobs should open up."
62,Physical Therapist Assistant,6.0,33200,10.7,59770,"Physical therapists generally examine a patient and prescribe a plan of care. It's the job of the physical therapist assistant to carry out that plan. Their work can include manually maneuvering a patient's body for different massages or stretches prescribed to relieve damages incurred by disease or injury. Or they might explain different exercises and observe the patients while they do them. They might also use different equipment or machines to help with therapy. Years ago, Chris Garland's mother underwent ACL surgery. In the days that followed, Garland took her mother to physical therapy appointments. ""I sat back and watched,"" she says. What she saw was science and problem-solving in action. She saw compassionate physical therapists and physical therapist assistants building relationships with their patients and helping them reach their fullest potential. Garland was hooked. After more than 15 years of working in marketing, Garland went back to school, earned an associate degree in Applied Science and became a physical therapist assistant. ""I kicked myself for not doing this sooner,"" she says. ""I wish I had done this 20 years ago."" The Bureau of Labor Statistics projects 35.4 percent employment growth for physical therapist assistants between 2020 and 2030. In that period, an estimated 33,200 jobs should open up."
